number,value,datetime_start,datetime_complete,duration,params_bootstrap,params_max_depth,params_max_features,params_min_samples_leaf,params_min_samples_split,params_n_estimators,state
0,0.5317879852575697,2026-06-16 11:35:45.398405,2026-06-16 11:35:47.178749,0 days 00:00:01.780344,True,19,log2,4,3,466,COMPLETE
1,0.6192231534790239,2026-06-16 11:35:47.181673,2026-06-16 11:36:22.247203,0 days 00:00:35.065530,False,7,,6,16,447,COMPLETE
2,0.6517611710463727,2026-06-16 11:36:22.248165,2026-06-16 11:36:26.786528,0 days 00:00:04.538363,False,9,sqrt,4,20,827,COMPLETE
3,0.6244709653284917,2026-06-16 11:36:26.787375,2026-06-16 11:37:09.838615,0 days 00:00:43.051240,False,22,,2,9,520,COMPLETE
4,0.7374481701179596,2026-06-16 11:37:09.839605,2026-06-16 11:37:11.212382,0 days 00:00:01.372777,True,29,sqrt,2,12,365,COMPLETE
5,0.6252118466357572,2026-06-16 11:37:11.215118,2026-06-16 11:38:11.013552,0 days 00:00:59.798434,False,12,,3,7,738,COMPLETE
6,0.7658383649489766,2026-06-16 11:38:11.015670,2026-06-16 11:38:14.026871,0 days 00:00:03.011201,True,36,sqrt,1,2,494,COMPLETE
7,0.6252592180314769,2026-06-16 11:38:14.029765,2026-06-16 11:38:46.182148,0 days 00:00:32.152383,False,32,,8,18,400,COMPLETE
8,0.5605521742594581,2026-06-16 11:38:46.184880,2026-06-16 11:38:48.133191,0 days 00:00:01.948311,True,7,sqrt,9,4,692,COMPLETE
9,0.6134216534399127,2026-06-16 11:38:48.134515,2026-06-16 11:38:51.702356,0 days 00:00:03.567841,False,8,sqrt,8,8,825,COMPLETE
10,0.4929230868725142,2026-06-16 11:38:51.704772,2026-06-16 11:38:53.404995,0 days 00:00:01.700223,True,36,log2,6,13,987,COMPLETE
11,0.752798143952838,2026-06-16 11:38:53.407022,2026-06-16 11:38:54.593609,0 days 00:00:01.186587,True,29,sqrt,1,12,269,COMPLETE
12,0.7450917394634196,2026-06-16 11:38:54.594728,2026-06-16 11:38:55.608198,0 days 00:00:01.013470,True,40,sqrt,2,2,202,COMPLETE
13,0.7494854035577156,2026-06-16 11:38:55.609520,2026-06-16 11:38:56.617105,0 days 00:00:01.007585,True,26,sqrt,1,12,204,COMPLETE
14,0.7636990367447202,2026-06-16 11:38:56.618518,2026-06-16 11:38:59.180270,0 days 00:00:02.561752,True,33,sqrt,1,5,602,COMPLETE
15,0.7644380777024786,2026-06-16 11:38:59.181630,2026-06-16 11:39:01.701272,0 days 00:00:02.519642,True,40,sqrt,1,5,581,COMPLETE
16,0.5498675966589078,2026-06-16 11:39:01.703154,2026-06-16 11:39:02.895712,0 days 00:00:01.192558,True,40,log2,4,6,564,COMPLETE
17,0.7274964536370452,2026-06-16 11:39:02.897022,2026-06-16 11:39:05.301038,0 days 00:00:02.404016,True,37,sqrt,3,2,644,COMPLETE
18,0.7263887337463626,2026-06-16 11:39:05.303058,2026-06-16 11:39:06.659902,0 days 00:00:01.356844,True,35,sqrt,3,5,327,COMPLETE
19,0.7217539689350507,2026-06-16 11:39:06.661495,2026-06-16 11:39:08.108990,0 days 00:00:01.447495,True,40,log2,1,9,525,COMPLETE
20,0.6942843627913071,2026-06-16 11:39:08.110327,2026-06-16 11:39:10.793922,0 days 00:00:02.683595,True,30,sqrt,5,4,773,COMPLETE
21,0.7641292202906028,2026-06-16 11:39:10.795049,2026-06-16 11:39:13.347552,0 days 00:00:02.552503,True,34,sqrt,1,5,597,COMPLETE
22,0.7444324250438534,2026-06-16 11:39:13.348507,2026-06-16 11:39:15.693732,0 days 00:00:02.345225,True,36,sqrt,2,7,614,COMPLETE
23,0.7627519035635466,2026-06-16 11:39:15.696399,2026-06-16 11:39:18.503513,0 days 00:00:02.807114,True,25,sqrt,1,2,486,COMPLETE
24,0.7473548814605422,2026-06-16 11:39:18.504826,2026-06-16 11:39:21.194457,0 days 00:00:02.689631,True,33,sqrt,2,4,681,COMPLETE
25,0.7270964873657606,2026-06-16 11:39:21.196131,2026-06-16 11:39:23.413825,0 days 00:00:02.217694,True,38,sqrt,3,6,580,COMPLETE
26,0.7562994585042514,2026-06-16 11:39:23.415385,2026-06-16 11:39:25.574399,0 days 00:00:02.159014,True,34,sqrt,1,10,530,COMPLETE
27,0.746992483205194,2026-06-16 11:39:25.576784,2026-06-16 11:39:27.242742,0 days 00:00:01.665958,True,38,sqrt,2,3,396,COMPLETE
28,0.708046420155146,2026-06-16 11:39:27.243836,2026-06-16 11:39:29.564880,0 days 00:00:02.321044,True,26,log2,1,6,957,COMPLETE
29,0.7514085540858675,2026-06-16 11:39:29.566774,2026-06-16 11:39:50.494680,0 days 00:00:20.927906,True,16,,3,3,467,COMPLETE
30,0.5494220545258568,2026-06-16 11:39:50.497343,2026-06-16 11:39:51.834333,0 days 00:00:01.336990,True,31,log2,4,5,683,COMPLETE
31,0.7637947598763123,2026-06-16 11:39:51.835448,2026-06-16 11:39:54.423076,0 days 00:00:02.587628,True,33,sqrt,1,5,607,COMPLETE
32,0.7467855461136568,2026-06-16 11:39:54.424407,2026-06-16 11:39:56.276745,0 days 00:00:01.852338,True,34,sqrt,2,4,446,COMPLETE
33,0.7615973048047691,2026-06-16 11:39:56.278512,2026-06-16 11:39:58.928220,0 days 00:00:02.649708,True,38,sqrt,1,7,639,COMPLETE
34,0.7650361315063396,2026-06-16 11:39:58.930919,2026-06-16 11:40:02.487213,0 days 00:00:03.556294,False,31,sqrt,2,3,567,COMPLETE
35,0.6098065624213793,2026-06-16 11:40:02.488623,2026-06-16 11:40:49.136378,0 days 00:00:46.647755,False,23,,2,3,551,COMPLETE
36,0.7641638944247661,2026-06-16 11:40:49.139046,2026-06-16 11:40:51.854128,0 days 00:00:02.715082,False,29,sqrt,2,2,434,COMPLETE
37,0.7229524713235709,2026-06-16 11:40:51.855644,2026-06-16 11:40:54.361380,0 days 00:00:02.505736,False,28,sqrt,5,2,425,COMPLETE
38,0.6119540556906854,2026-06-16 11:40:54.362965,2026-06-16 11:41:34.793514,0 days 00:00:40.430549,False,28,,3,3,487,COMPLETE
39,0.7438444350835008,2026-06-16 11:41:34.795536,2026-06-16 11:41:37.771571,0 days 00:00:02.976035,False,20,sqrt,2,20,498,COMPLETE
40,0.7309005477251855,2026-06-16 11:41:37.772855,2026-06-16 11:41:39.856719,0 days 00:00:02.083864,False,31,sqrt,4,16,334,COMPLETE
41,0.7651062254649803,2026-06-16 11:41:39.858008,2026-06-16 11:41:43.466600,0 days 00:00:03.608592,False,36,sqrt,2,4,560,COMPLETE
42,0.5105729975243083,2026-06-16 11:41:43.467881,2026-06-16 11:41:45.117280,0 days 00:00:01.649399,False,5,sqrt,2,3,421,COMPLETE
43,0.6747806486628815,2026-06-16 11:41:45.118732,2026-06-16 11:41:47.234232,0 days 00:00:02.115500,False,36,sqrt,10,4,370,COMPLETE
44,0.7503392348538153,2026-06-16 11:41:47.235780,2026-06-16 11:41:50.497735,0 days 00:00:03.261955,False,38,sqrt,3,2,538,COMPLETE
45,0.7650148008196291,2026-06-16 11:41:50.498847,2026-06-16 11:41:54.995241,0 days 00:00:04.496394,False,32,sqrt,2,3,715,COMPLETE
46,0.6259987519632673,2026-06-16 11:41:54.997340,2026-06-16 11:42:56.877044,0 days 00:01:01.879704,False,32,,2,8,741,COMPLETE
47,0.7361809852294924,2026-06-16 11:42:56.880264,2026-06-16 11:43:01.597715,0 days 00:00:04.717451,False,36,sqrt,4,6,834,COMPLETE
48,0.7505639621458002,2026-06-16 11:43:01.599517,2026-06-16 11:43:05.464811,0 days 00:00:03.865294,False,40,sqrt,3,4,653,COMPLETE
49,0.5284197626111343,2026-06-16 11:43:05.466824,2026-06-16 11:43:07.188722,0 days 00:00:01.721898,False,31,log2,7,3,739,COMPLETE
50,0.7734415793806397,2026-06-16 11:43:07.190295,2026-06-16 11:43:12.738364,0 days 00:00:05.548069,False,35,sqrt,1,7,887,COMPLETE
51,0.7731923671292459,2026-06-16 11:43:12.740378,2026-06-16 11:43:18.339140,0 days 00:00:05.598762,False,39,sqrt,1,7,882,COMPLETE
52,0.7721942024722891,2026-06-16 11:43:18.340638,2026-06-16 11:43:23.842692,0 days 00:00:05.502054,False,35,sqrt,1,9,880,COMPLETE
53,0.7710260448743755,2026-06-16 11:43:23.844053,2026-06-16 11:43:29.436757,0 days 00:00:05.592704,False,35,sqrt,1,11,912,COMPLETE
54,0.7722079963605243,2026-06-16 11:43:29.438561,2026-06-16 11:43:35.033835,0 days 00:00:05.595274,False,35,sqrt,1,10,904,COMPLETE
55,0.7710153606354249,2026-06-16 11:43:35.036443,2026-06-16 11:43:40.573438,0 days 00:00:05.536995,False,35,sqrt,1,11,907,COMPLETE
56,0.7710048250052297,2026-06-16 11:43:40.575452,2026-06-16 11:43:46.174187,0 days 00:00:05.598735,False,35,sqrt,1,11,915,COMPLETE
57,0.7675919954791397,2026-06-16 11:43:46.176839,2026-06-16 11:43:51.470713,0 days 00:00:05.293874,False,38,sqrt,1,14,878,COMPLETE
58,0.772235505126299,2026-06-16 11:43:51.472701,2026-06-16 11:43:57.028840,0 days 00:00:05.556139,False,35,sqrt,1,10,896,COMPLETE
59,0.7717907841727482,2026-06-16 11:43:57.030532,2026-06-16 11:44:02.369849,0 days 00:00:05.339317,False,37,sqrt,1,9,851,COMPLETE
60,0.6272273843306708,2026-06-16 11:44:02.371155,2026-06-16 11:45:10.187056,0 days 00:01:07.815901,False,39,,1,9,803,COMPLETE
61,0.7717398426774009,2026-06-16 11:45:10.189812,2026-06-16 11:45:15.421194,0 days 00:00:05.231382,False,37,sqrt,1,10,861,COMPLETE
62,0.7733454504124685,2026-06-16 11:45:15.422556,2026-06-16 11:45:20.788000,0 days 00:00:05.365444,False,39,sqrt,1,8,860,COMPLETE
63,0.7733746356256785,2026-06-16 11:45:20.790100,2026-06-16 11:45:26.975907,0 days 00:00:06.185807,False,39,sqrt,1,8,994,COMPLETE
64,0.7733797129972396,2026-06-16 11:45:26.977519,2026-06-16 11:45:33.161301,0 days 00:00:06.183782,False,39,sqrt,1,8,993,COMPLETE
65,0.7734785543128836,2026-06-16 11:45:33.162897,2026-06-16 11:45:39.282893,0 days 00:00:06.119996,False,39,sqrt,1,8,984,COMPLETE
66,0.7466986312664042,2026-06-16 11:45:39.284067,2026-06-16 11:45:42.776232,0 days 00:00:03.492165,False,39,log2,1,8,998,COMPLETE
67,0.7631403936427044,2026-06-16 11:45:42.777455,2026-06-16 11:45:48.503373,0 days 00:00:05.725918,False,39,sqrt,2,8,962,COMPLETE
68,0.7735889293473138,2026-06-16 11:45:48.505318,2026-06-16 11:45:54.516079,0 days 00:00:06.010761,False,40,sqrt,1,7,954,COMPLETE
69,0.7640952082873274,2026-06-16 11:45:54.518760,2026-06-16 11:46:00.151634,0 days 00:00:05.632874,False,40,sqrt,2,7,943,COMPLETE
70,0.7732649241966312,2026-06-16 11:46:00.152739,2026-06-16 11:46:06.299864,0 days 00:00:06.147125,False,39,sqrt,1,7,974,COMPLETE
71,0.7732649241966314,2026-06-16 11:46:06.301336,2026-06-16 11:46:12.410853,0 days 00:00:06.109517,False,39,sqrt,1,7,974,COMPLETE
72,0.7726048615764235,2026-06-16 11:46:12.412694,2026-06-16 11:46:18.390475,0 days 00:00:05.977781,False,37,sqrt,1,8,971,COMPLETE
73,0.7732796311775264,2026-06-16 11:46:18.392079,2026-06-16 11:46:24.320025,0 days 00:00:05.927946,False,39,sqrt,1,7,936,COMPLETE
74,0.7736776545933196,2026-06-16 11:46:24.321605,2026-06-16 11:46:30.268179,0 days 00:00:05.946574,False,40,sqrt,1,6,937,COMPLETE
75,0.7631453322623974,2026-06-16 11:46:30.269556,2026-06-16 11:46:35.857517,0 days 00:00:05.587961,False,40,sqrt,2,9,935,COMPLETE
76,0.7648968584359388,2026-06-16 11:46:35.858782,2026-06-16 11:46:41.497935,0 days 00:00:05.639153,False,38,sqrt,2,6,929,COMPLETE
77,0.7483117023007851,2026-06-16 11:46:41.499515,2026-06-16 11:46:44.442257,0 days 00:00:02.942742,False,37,log2,1,6,798,COMPLETE
78,0.7731397663461487,2026-06-16 11:46:44.443840,2026-06-16 11:46:50.642201,0 days 00:00:06.198361,False,40,sqrt,1,8,994,COMPLETE
79,0.7642762061001855,2026-06-16 11:46:50.643803,2026-06-16 11:46:56.338409,0 days 00:00:05.694606,False,38,sqrt,2,7,949,COMPLETE
80,0.6239167759694713,2026-06-16 11:46:56.340000,2026-06-16 11:48:14.644732,0 days 00:01:18.304732,False,37,,1,8,929,COMPLETE
81,0.7732527660721612,2026-06-16 11:48:14.647469,2026-06-16 11:48:20.708399,0 days 00:00:06.060930,False,39,sqrt,1,7,975,COMPLETE
82,0.77369370134188,2026-06-16 11:48:20.710110,2026-06-16 11:48:26.931297,0 days 00:00:06.221187,False,40,sqrt,1,6,999,COMPLETE
83,0.7645929202966425,2026-06-16 11:48:26.932048,2026-06-16 11:48:32.799925,0 days 00:00:05.867877,False,40,sqrt,2,6,993,COMPLETE
84,0.7527529907475786,2026-06-16 11:48:32.801974,2026-06-16 11:48:38.343357,0 days 00:00:05.541383,False,15,sqrt,1,5,952,COMPLETE
85,0.7627564833469506,2026-06-16 11:48:38.346133,2026-06-16 11:48:43.501842,0 days 00:00:05.155709,False,38,sqrt,2,9,853,COMPLETE
86,0.7729241853020967,2026-06-16 11:48:43.502335,2026-06-16 11:48:49.188261,0 days 00:00:05.685926,False,36,sqrt,1,8,927,COMPLETE
87,0.7731798565848488,2026-06-16 11:48:49.191061,2026-06-16 11:48:55.255624,0 days 00:00:06.064563,False,37,sqrt,1,5,948,COMPLETE
88,0.7645012041013818,2026-06-16 11:48:55.256907,2026-06-16 11:49:00.284239,0 days 00:00:05.027332,False,40,sqrt,2,6,826,COMPLETE
89,0.7733480089553014,2026-06-16 11:49:00.285547,2026-06-16 11:49:06.480857,0 days 00:00:06.195310,False,34,sqrt,1,7,981,COMPLETE
90,0.7716730394919026,2026-06-16 11:49:06.482170,2026-06-16 11:49:12.649197,0 days 00:00:06.167027,False,34,sqrt,1,9,984,COMPLETE
91,0.7737801468478793,2026-06-16 11:49:12.651851,2026-06-16 11:49:18.939760,0 days 00:00:06.287909,False,38,sqrt,1,7,1000,COMPLETE
92,0.7732887134101623,2026-06-16 11:49:18.940464,2026-06-16 11:49:25.120170,0 days 00:00:06.179706,False,33,sqrt,1,7,997,COMPLETE
93,0.7732365237705124,2026-06-16 11:49:25.121815,2026-06-16 11:49:31.087355,0 days 00:00:05.965540,False,38,sqrt,1,8,958,COMPLETE
94,0.7739205502146349,2026-06-16 11:49:31.089442,2026-06-16 11:49:36.806948,0 days 00:00:05.717506,False,37,sqrt,1,6,892,COMPLETE
95,0.7655192683737609,2026-06-16 11:49:36.809568,2026-06-16 11:49:42.188209,0 days 00:00:05.378641,False,34,sqrt,2,5,893,COMPLETE
96,0.7481462870833527,2026-06-16 11:49:42.189515,2026-06-16 11:49:45.724086,0 days 00:00:03.534571,False,36,log2,1,6,1000,COMPLETE
97,0.7744157733635728,2026-06-16 11:49:45.727341,2026-06-16 11:49:51.856378,0 days 00:00:06.129037,False,38,sqrt,1,6,965,COMPLETE
98,0.7648299190075938,2026-06-16 11:49:51.858432,2026-06-16 11:49:57.348971,0 days 00:00:05.490539,False,37,sqrt,2,6,913,COMPLETE
99,0.611833247611512,2026-06-16 11:49:57.350998,2026-06-16 11:51:18.492230,0 days 00:01:21.141232,False,38,,2,5,964,COMPLETE
